{
  "$schema": "https://json-schema.org/draft/2020-12/schema",
  "title": "SEO Knowledge Rule Update",
  "description": "Versioned update to the SEO agent system knowledge base or operating rules.",
  "type": "object",
  "additionalProperties": false,
  "required": [
    "rule_id",
    "version",
    "target_agent",
    "rule_type",
    "source_type",
    "source_url",
    "confidence",
    "old_context",
    "new_instruction",
    "validation_check",
    "review_date"
  ],
  "properties": {
    "rule_id": {
      "type": "string",
      "description": "Stable rule identifier."
    },
    "version": {
      "type": "string",
      "description": "Semantic version for this rule update."
    },
    "target_agent": {
      "type": "string",
      "description": "Agent or agent group affected by the update."
    },
    "rule_type": {
      "type": "string",
      "description": "Type of rule change.",
      "enum": [
        "Enforce_New_Standard",
        "Ban_Practice",
        "New_Tactic_Alert",
        "Measurement_Update",
        "Deprecation"
      ]
    },
    "source_type": {
      "type": "string",
      "description": "Evidence class behind the rule.",
      "enum": [
        "Official",
        "First_Party_Data",
        "Experiment",
        "Industry_Hypothesis"
      ]
    },
    "source_url": {
      "type": "string",
      "description": "URL or durable reference for the source."
    },
    "confidence": {
      "type": "string",
      "description": "Confidence level.",
      "enum": ["High", "Medium", "Low"]
    },
    "old_context": {
      "type": "string",
      "description": "Previous assumption or rule context."
    },
    "new_instruction": {
      "type": "string",
      "description": "New operational instruction for affected agents."
    },
    "validation_check": {
      "type": "string",
      "description": "How SEO Scrummaster Agent verifies adoption."
    },
    "review_date": {
      "type": "string",
      "description": "Date when rule should be reviewed, preferably YYYY-MM-DD."
    }
  },
  "examples": [
    {
      "rule_id": "seo-rule-20260703-inp-cwv",
      "version": "1.0.0",
      "target_agent": "SEO Technical Agent",
      "rule_type": "Measurement_Update",
      "source_type": "Official",
      "source_url": "https://developers.google.com/search/docs/appearance/core-web-vitals",
      "confidence": "High",
      "old_context": "Some workflows used generic Core Web Vitals language.",
      "new_instruction": "Core Web Vitals reviews must explicitly evaluate LCP, INP, and CLS.",
      "validation_check": "Technical audit outputs name LCP, INP, and CLS when CWV is in scope.",
      "review_date": "2026-10-03"
    }
  ]
}
